{"$id":"https://single-image-studio.invalid/research/slice-08/schemas/capability-contract.slice08.v0.schema.json","$schema":"https://json-schema.org/draft/2020-12/schema","additionalProperties":false,"properties":{"candidateRef":{"additionalProperties":false,"properties":{"byteLength":{"minimum":2,"type":"integer"},"contentHash":{"pattern":"^[a-f0-9]{64}$","type":"string"},"fileSha256":{"pattern":"^[a-f0-9]{64}$","type":"string"},"id":{"pattern":"^[A-Za-z0-9][A-Za-z0-9._:@-]{0,199}$","type":"string"},"path":{"type":"string"}},"required":["path","id","contentHash","byteLength","fileSha256"],"type":"object"},"contentHash":{"pattern":"^[a-f0-9]{64}$","type":"string"},"evidenceBoundary":{"additionalProperties":false,"properties":{"C1":{"const":0},"E1":{"const":0},"G1":{"const":0},"O1":{"const":0},"R1":{"const":0},"U1":{"const":0},"V1":{"const":0},"formal":{"const":false},"productSupport":{"const":false},"releaseAllowlist":{"const":"none"},"releaseApproved":{"const":0},"releaseRegistered":{"const":0}},"required":["C1","U1","E1","R1","O1","G1","V1","productSupport","formal","releaseAllowlist","releaseRegistered","releaseApproved"],"type":"object"},"fallback":{"const":false},"frozenAt":{"type":"string"},"id":{"pattern":"^[A-Za-z0-9][A-Za-z0-9._:@-]{0,199}$","type":"string"},"maxDimension":{"const":256},"maxOutputBytes":{"const":1048576},"operation":{"enum":["normalize","export"]},"oracleRepair":{"const":false},"outputProfile":{"const":"canonical-png-IHDR-sRGB-IDAT-IEND-filter0"},"passthrough":{"const":false},"productSupport":{"const":false},"schemaVersion":{"const":"capability-contract.slice08.v0"}},"required":["schemaVersion","id","operation","candidateRef","outputProfile","maxDimension","maxOutputBytes","passthrough","fallback","oracleRepair","productSupport","frozenAt","evidenceBoundary","contentHash"],"type":"object"}
