{"candidateRef":{"byteLength":2218,"contentHash":"86d79843854ae2635aa62c0c8d94d6fc32d07820b8a42bc9b6a0680e6b550950","fileSha256":"3d7477f0501d4c631f05092b590185ce0134e218e6c32c29de40a258be7716b4","id":"REG-NORM-SHARP-CANONICAL-PNG@0.8.0","path":"candidate-locks/composite-canonical-png.v0.8.0.json"},"contentHash":"92827811d4219f9c3ea11a0015cb4300d4cbf2bb02fbbd769c7c7da66bd48fce","evidenceBoundary":{"C1":0,"E1":0,"G1":0,"O1":0,"R1":0,"U1":0,"V1":0,"formal":false,"productSupport":false,"releaseAllowlist":"none","releaseApproved":0,"releaseRegistered":0},"fallback":false,"frozenAt":"2026-08-15T13:37:23.038Z","id":"CC-CAP02-NORMALIZE-PNG@0.8.0","maxDimension":256,"maxOutputBytes":1048576,"operation":"normalize","oracleRepair":false,"outputProfile":"canonical-png-IHDR-sRGB-IDAT-IEND-filter0","passthrough":false,"productSupport":false,"schemaVersion":"capability-contract.slice08.v0"}
